{
  "schemaVersion": 2,
  "id": "office-ten-v1",
  "status": "accepted-staging",
  "activeOfficePromotion": false,
  "commercialCharacterApproval": false,
  "grid": { "width": 29, "height": 20, "tilePixels": 32 },
  "structures": [
    {
      "id": "floor-main",
      "kind": "floor-region",
      "bounds": { "x": 0, "y": 4, "width": 29, "height": 16 },
      "material": "floor.grid.cool-gray",
      "navigationPolicy": "walkable",
      "collisionOwner": true
    },
    {
      "id": "wall-back",
      "kind": "wall-segment",
      "bounds": { "x": 0, "y": 0, "width": 29, "height": 4 },
      "material": "wall.panel.cool-gray",
      "coordinateSpace": "wall-local",
      "floorYSort": false
    },
    {
      "id": "window-main",
      "kind": "window-opening",
      "parentWallId": "wall-back",
      "opening": { "x": 7, "y": 0.5, "width": 14, "height": 2.75, "coordinateSpace": "wall-local" },
      "viewport": { "x": 0.25, "y": 0.25, "width": 13.5, "height": 2.25, "coordinateSpace": "viewport-local" },
      "frameAssetId": "window.frame.v1",
      "contentSetId": "office.window.seasonal.v2",
      "floorCollision": false
    },
    {
      "id": "door-main",
      "kind": "door-opening",
      "parentWallId": "wall-back",
      "portalId": "portal-main",
      "opening": { "x": 25.5, "y": 1, "width": 2.5, "height": 3, "coordinateSpace": "wall-local" },
      "frameAssetId": "door.frame.v1",
      "leafAssetId": "door.closed.leaf.v1",
      "state": "closed",
      "floorYSort": false
    }
  ],
  "portals": [
    {
      "id": "portal-main",
      "doorOpeningId": "door-main",
      "cells": [{ "x": 26, "y": 4 }, { "x": 27, "y": 4 }],
      "statePolicy": { "open": "passable", "closed": "blocked" }
    }
  ],
  "routes": [
    { "id": "back-access-aisle", "x": 0, "y": 4, "width": 29, "height": 1 },
    { "id": "front-access-aisle", "x": 0, "y": 15, "width": 29, "height": 1 },
    { "id": "west-access-aisle", "x": 0, "y": 4, "width": 2, "height": 12 },
    { "id": "east-access-aisle", "x": 27, "y": 4, "width": 2, "height": 12 }
  ],
  "workstationDeployments": [
    {
      "id": "staging-station-01",
      "agentId": "market-scout",
      "presetId": "standard-single",
      "role": "standard",
      "deskFamilyId": "desk.modular.v1",
      "orientation": "front",
      "facing": "down",
      "floorRegionId": "floor-main",
      "footprint": { "x": 2, "y": 6, "width": 5, "depth": 4 },
      "supportPlane": { "id": "desk-surface", "x": 2, "y": 6, "width": 5, "depth": 3 },
      "seat": { "x": 4, "y": 5, "width": 1, "depth": 1 },
      "approach": { "x": 4, "y": 4 },
      "stand": { "x": 4, "y": 5 },
      "basePivot": { "x": 4.5, "y": 10 },
      "sortPivot": { "x": 4.5, "y": 10 }
    },
    {
      "id": "staging-station-02",
      "agentId": "product-ranker",
      "presetId": "standard-single",
      "role": "standard",
      "deskFamilyId": "desk.modular.v1",
      "orientation": "front",
      "facing": "down",
      "floorRegionId": "floor-main",
      "footprint": { "x": 7, "y": 6, "width": 5, "depth": 4 },
      "supportPlane": { "id": "desk-surface", "x": 7, "y": 6, "width": 5, "depth": 3 },
      "seat": { "x": 9, "y": 5, "width": 1, "depth": 1 },
      "approach": { "x": 9, "y": 4 },
      "stand": { "x": 9, "y": 5 },
      "basePivot": { "x": 9.5, "y": 10 },
      "sortPivot": { "x": 9.5, "y": 10 }
    },
    {
      "id": "staging-station-03",
      "agentId": "growth-strategist",
      "presetId": "standard-single",
      "role": "standard",
      "deskFamilyId": "desk.modular.v1",
      "orientation": "front",
      "facing": "down",
      "floorRegionId": "floor-main",
      "footprint": { "x": 12, "y": 6, "width": 5, "depth": 4 },
      "supportPlane": { "id": "desk-surface", "x": 12, "y": 6, "width": 5, "depth": 3 },
      "seat": { "x": 14, "y": 5, "width": 1, "depth": 1 },
      "approach": { "x": 14, "y": 4 },
      "stand": { "x": 14, "y": 5 },
      "basePivot": { "x": 14.5, "y": 10 },
      "sortPivot": { "x": 14.5, "y": 10 }
    },
    {
      "id": "staging-station-04",
      "agentId": "performance-analyst",
      "presetId": "standard-dual",
      "role": "standard",
      "deskFamilyId": "desk.modular.v1",
      "orientation": "front",
      "facing": "down",
      "floorRegionId": "floor-main",
      "footprint": { "x": 17, "y": 6, "width": 5, "depth": 4 },
      "supportPlane": { "id": "desk-surface", "x": 17, "y": 6, "width": 5, "depth": 3 },
      "seat": { "x": 19, "y": 5, "width": 1, "depth": 1 },
      "approach": { "x": 19, "y": 4 },
      "stand": { "x": 19, "y": 5 },
      "basePivot": { "x": 19.5, "y": 10 },
      "sortPivot": { "x": 19.5, "y": 10 }
    },
    {
      "id": "staging-station-05",
      "agentId": "gemini-copywriter",
      "presetId": "creative-dual-tablet",
      "role": "creative",
      "deskFamilyId": "desk.modular.v1",
      "orientation": "front",
      "facing": "down",
      "floorRegionId": "floor-main",
      "footprint": { "x": 22, "y": 6, "width": 5, "depth": 4 },
      "supportPlane": { "id": "desk-surface", "x": 22, "y": 6, "width": 5, "depth": 3 },
      "seat": { "x": 24, "y": 5, "width": 1, "depth": 1 },
      "approach": { "x": 24, "y": 4 },
      "stand": { "x": 24, "y": 5 },
      "basePivot": { "x": 24.5, "y": 10 },
      "sortPivot": { "x": 24.5, "y": 10 }
    },
    {
      "id": "staging-station-06",
      "agentId": "flow-visual-producer",
      "presetId": "creative-dual-tablet",
      "role": "creative",
      "deskFamilyId": "desk.modular.v1",
      "orientation": "back",
      "facing": "up",
      "floorRegionId": "floor-main",
      "footprint": { "x": 2, "y": 10, "width": 5, "depth": 4 },
      "supportPlane": { "id": "desk-surface", "x": 2, "y": 11, "width": 5, "depth": 3 },
      "seat": { "x": 4, "y": 14, "width": 1, "depth": 1 },
      "approach": { "x": 4, "y": 15 },
      "stand": { "x": 4, "y": 14 },
      "basePivot": { "x": 4.5, "y": 14 },
      "sortPivot": { "x": 4.5, "y": 14 }
    },
    {
      "id": "staging-station-07",
      "agentId": "link-attribution",
      "presetId": "standard-single",
      "role": "standard",
      "deskFamilyId": "desk.modular.v1",
      "orientation": "back",
      "facing": "up",
      "floorRegionId": "floor-main",
      "footprint": { "x": 7, "y": 10, "width": 5, "depth": 4 },
      "supportPlane": { "id": "desk-surface", "x": 7, "y": 11, "width": 5, "depth": 3 },
      "seat": { "x": 9, "y": 14, "width": 1, "depth": 1 },
      "approach": { "x": 9, "y": 15 },
      "stand": { "x": 9, "y": 14 },
      "basePivot": { "x": 9.5, "y": 14 },
      "sortPivot": { "x": 9.5, "y": 14 }
    },
    {
      "id": "staging-station-08",
      "agentId": "qa-editor",
      "presetId": "standard-single",
      "role": "standard",
      "deskFamilyId": "desk.modular.v1",
      "orientation": "back",
      "facing": "up",
      "floorRegionId": "floor-main",
      "footprint": { "x": 12, "y": 10, "width": 5, "depth": 4 },
      "supportPlane": { "id": "desk-surface", "x": 12, "y": 11, "width": 5, "depth": 3 },
      "seat": { "x": 14, "y": 14, "width": 1, "depth": 1 },
      "approach": { "x": 14, "y": 15 },
      "stand": { "x": 14, "y": 14 },
      "basePivot": { "x": 14.5, "y": 14 },
      "sortPivot": { "x": 14.5, "y": 14 }
    },
    {
      "id": "staging-station-09",
      "agentId": "publisher",
      "presetId": "standard-dual",
      "role": "standard",
      "deskFamilyId": "desk.modular.v1",
      "orientation": "back",
      "facing": "up",
      "floorRegionId": "floor-main",
      "footprint": { "x": 17, "y": 10, "width": 5, "depth": 4 },
      "supportPlane": { "id": "desk-surface", "x": 17, "y": 11, "width": 5, "depth": 3 },
      "seat": { "x": 19, "y": 14, "width": 1, "depth": 1 },
      "approach": { "x": 19, "y": 15 },
      "stand": { "x": 19, "y": 14 },
      "basePivot": { "x": 19.5, "y": 14 },
      "sortPivot": { "x": 19.5, "y": 14 }
    },
    {
      "id": "staging-station-10",
      "agentId": "session-keeper",
      "presetId": "noc-dual-status",
      "role": "noc",
      "deskFamilyId": "desk.modular.v1",
      "orientation": "back",
      "facing": "up",
      "floorRegionId": "floor-main",
      "footprint": { "x": 22, "y": 10, "width": 5, "depth": 4 },
      "supportPlane": { "id": "desk-surface", "x": 22, "y": 11, "width": 5, "depth": 3 },
      "seat": { "x": 24, "y": 14, "width": 1, "depth": 1 },
      "approach": { "x": 24, "y": 15 },
      "stand": { "x": 24, "y": 14 },
      "basePivot": { "x": 24.5, "y": 14 },
      "sortPivot": { "x": 24.5, "y": 14 }
    }
  ],
  "acceptance": {
    "requiredDurationSeconds": 60,
    "sharedSceneClock": true,
    "backgroundBitmapAllowed": false
  }
}
